{"$schema":"https://json-schema.org/draft/2020-12/schema","$id":"https://agile-v.org/schemas/EVIDENCE_PROPERTY_PROFILE.schema.json","title":"Evidence property profile (required properties by claim type / risk level)","type":"object","required":["schema_version","compatibility","migration","fixture_owner","profile"],"properties":{"schema_version":{"const":"1.0"},"compatibility":{"type":"string","minLength":1},"migration":{"type":"string","minLength":1},"fixture_owner":{"type":"string","minLength":1},"profile":{"type":"object","required":["profile_id","claim_type","risk_level","required_properties"],"properties":{"profile_id":{"type":"string","minLength":1},"claim_type":{"type":"string","minLength":1},"risk_level":{"enum":["L0","L1","L2","L3","L4"]},"required_properties":{"type":"array","minItems":1,"items":{"type":"string"}}},"additionalProperties":true}},"additionalProperties":false}
